{
  "schema_version": "flower.engine-fixture/v1",
  "name": "attempt-lifecycle",
  "definition": {
    "id": "attempt-lifecycle",
    "nodes": [
      {
        "id": "start",
        "kind": "start",
        "retry_policy": null
      },
      {
        "id": "work",
        "kind": "activity",
        "retry_policy": null
      },
      {
        "id": "finish",
        "kind": "finish",
        "retry_policy": null
      }
    ],
    "edges": [
      {
        "id": "start-work",
        "source": "start",
        "target": "work"
      },
      {
        "id": "work-finish",
        "source": "work",
        "target": "finish"
      }
    ]
  },
  "expected_compile": {
    "outcome": "plan",
    "plan": {
      "workflow_id": "attempt-lifecycle",
      "fingerprint": "3e05d56c1850bbfb7efca401e8ce02181104ec70b421b06919f8d9f09aad702f",
      "nodes": [
        {
          "id": "start",
          "kind": "start",
          "retry_policy": null
        },
        {
          "id": "work",
          "kind": "activity",
          "retry_policy": {
            "max_attempts": 1,
            "retryable_failure_codes": [],
            "backoff": {
              "type": "none"
            }
          }
        },
        {
          "id": "finish",
          "kind": "finish",
          "retry_policy": null
        }
      ]
    }
  },
  "steps": [
    {
      "snapshot": null,
      "event": {
        "type": "execution-started",
        "execution_id": "execution",
        "plan_reference": {
          "workflow_id": "attempt-lifecycle",
          "fingerprint": "3e05d56c1850bbfb7efca401e8ce02181104ec70b421b06919f8d9f09aad702f"
        },
        "input": {
          "media_type": "text/plain",
          "bytes": [
            105,
            110,
            112,
            117,
            116
          ]
        }
      },
      "expected": {
        "outcome": "transition",
        "snapshot": {
          "execution_id": "execution",
          "plan_reference": {
            "workflow_id": "attempt-lifecycle",
            "fingerprint": "3e05d56c1850bbfb7efca401e8ce02181104ec70b421b06919f8d9f09aad702f"
          },
          "revision": 1,
          "state": {
            "type": "awaiting-attempt",
            "activation": {
              "activation_id": "activation-0239961b256cdef6e3b3170a6dd6bd82ee4e09c94d04cf205d3a087a7af295a3",
              "activation_revision": 1,
              "node_id": "work",
              "input": {
                "media_type": "text/plain",
                "bytes": [
                  105,
                  110,
                  112,
                  117,
                  116
                ]
              }
            },
            "attempt": {
              "attempt_id": "attempt-1b215169c3fa26d90328dda6d155fcda8b23633b932c9a5b508d49e59898878c",
              "attempt_number": 1,
              "effect_id": "effect-86de4f29c73a686283958d018c2a7a36cf7bda71b5044760f1fdbe0d6498721a"
            }
          }
        },
        "effects": [
          {
            "type": "execute-node-attempt",
            "effect_id": "effect-86de4f29c73a686283958d018c2a7a36cf7bda71b5044760f1fdbe0d6498721a",
            "activation_id": "activation-0239961b256cdef6e3b3170a6dd6bd82ee4e09c94d04cf205d3a087a7af295a3",
            "attempt_id": "attempt-1b215169c3fa26d90328dda6d155fcda8b23633b932c9a5b508d49e59898878c",
            "attempt_number": 1,
            "node_id": "work",
            "input": {
              "media_type": "text/plain",
              "bytes": [
                105,
                110,
                112,
                117,
                116
              ]
            }
          }
        ]
      }
    },
    {
      "snapshot": {
        "execution_id": "execution",
        "plan_reference": {
          "workflow_id": "attempt-lifecycle",
          "fingerprint": "3e05d56c1850bbfb7efca401e8ce02181104ec70b421b06919f8d9f09aad702f"
        },
        "revision": 1,
        "state": {
          "type": "awaiting-attempt",
          "activation": {
            "activation_id": "activation-0239961b256cdef6e3b3170a6dd6bd82ee4e09c94d04cf205d3a087a7af295a3",
            "activation_revision": 1,
            "node_id": "work",
            "input": {
              "media_type": "text/plain",
              "bytes": [
                105,
                110,
                112,
                117,
                116
              ]
            }
          },
          "attempt": {
            "attempt_id": "attempt-1b215169c3fa26d90328dda6d155fcda8b23633b932c9a5b508d49e59898878c",
            "attempt_number": 1,
            "effect_id": "effect-86de4f29c73a686283958d018c2a7a36cf7bda71b5044760f1fdbe0d6498721a"
          }
        }
      },
      "event": {
        "type": "node-attempt-succeeded",
        "execution_id": "execution",
        "expected_revision": 1,
        "activation_id": "activation-0239961b256cdef6e3b3170a6dd6bd82ee4e09c94d04cf205d3a087a7af295a3",
        "attempt_id": "attempt-1b215169c3fa26d90328dda6d155fcda8b23633b932c9a5b508d49e59898878c",
        "attempt_number": 1,
        "effect_id": "effect-86de4f29c73a686283958d018c2a7a36cf7bda71b5044760f1fdbe0d6498721a",
        "node_id": "work",
        "output": {
          "media_type": "text/plain",
          "bytes": [
            111,
            117,
            116,
            112,
            117,
            116
          ]
        }
      },
      "expected": {
        "outcome": "transition",
        "snapshot": {
          "execution_id": "execution",
          "plan_reference": {
            "workflow_id": "attempt-lifecycle",
            "fingerprint": "3e05d56c1850bbfb7efca401e8ce02181104ec70b421b06919f8d9f09aad702f"
          },
          "revision": 2,
          "state": {
            "type": "completed",
            "output": {
              "media_type": "text/plain",
              "bytes": [
                111,
                117,
                116,
                112,
                117,
                116
              ]
            }
          }
        },
        "effects": []
      }
    },
    {
      "snapshot": {
        "execution_id": "execution",
        "plan_reference": {
          "workflow_id": "attempt-lifecycle",
          "fingerprint": "3e05d56c1850bbfb7efca401e8ce02181104ec70b421b06919f8d9f09aad702f"
        },
        "revision": 1,
        "state": {
          "type": "awaiting-attempt",
          "activation": {
            "activation_id": "activation-0239961b256cdef6e3b3170a6dd6bd82ee4e09c94d04cf205d3a087a7af295a3",
            "activation_revision": 1,
            "node_id": "work",
            "input": {
              "media_type": "text/plain",
              "bytes": [
                105,
                110,
                112,
                117,
                116
              ]
            }
          },
          "attempt": {
            "attempt_id": "attempt-1b215169c3fa26d90328dda6d155fcda8b23633b932c9a5b508d49e59898878c",
            "attempt_number": 1,
            "effect_id": "effect-86de4f29c73a686283958d018c2a7a36cf7bda71b5044760f1fdbe0d6498721a"
          }
        }
      },
      "event": {
        "type": "node-attempt-failed",
        "execution_id": "execution",
        "expected_revision": 1,
        "activation_id": "activation-0239961b256cdef6e3b3170a6dd6bd82ee4e09c94d04cf205d3a087a7af295a3",
        "attempt_id": "attempt-1b215169c3fa26d90328dda6d155fcda8b23633b932c9a5b508d49e59898878c",
        "attempt_number": 1,
        "effect_id": "effect-86de4f29c73a686283958d018c2a7a36cf7bda71b5044760f1fdbe0d6498721a",
        "node_id": "work",
        "failure": {
          "code": "worker.failed",
          "details": {
            "media_type": "text/plain",
            "bytes": [
              100,
              101,
              116,
              97,
              105,
              108,
              115
            ]
          }
        }
      },
      "expected": {
        "outcome": "transition",
        "snapshot": {
          "execution_id": "execution",
          "plan_reference": {
            "workflow_id": "attempt-lifecycle",
            "fingerprint": "3e05d56c1850bbfb7efca401e8ce02181104ec70b421b06919f8d9f09aad702f"
          },
          "revision": 2,
          "state": {
            "type": "failed",
            "activation": {
              "activation_id": "activation-0239961b256cdef6e3b3170a6dd6bd82ee4e09c94d04cf205d3a087a7af295a3",
              "activation_revision": 1,
              "node_id": "work",
              "input": {
                "media_type": "text/plain",
                "bytes": [
                  105,
                  110,
                  112,
                  117,
                  116
                ]
              }
            },
            "attempt": {
              "attempt_id": "attempt-1b215169c3fa26d90328dda6d155fcda8b23633b932c9a5b508d49e59898878c",
              "attempt_number": 1,
              "effect_id": "effect-86de4f29c73a686283958d018c2a7a36cf7bda71b5044760f1fdbe0d6498721a"
            },
            "failure": {
              "code": "worker.failed",
              "details": {
                "media_type": "text/plain",
                "bytes": [
                  100,
                  101,
                  116,
                  97,
                  105,
                  108,
                  115
                ]
              }
            }
          }
        },
        "effects": []
      }
    },
    {
      "snapshot": {
        "execution_id": "execution",
        "plan_reference": {
          "workflow_id": "attempt-lifecycle",
          "fingerprint": "3e05d56c1850bbfb7efca401e8ce02181104ec70b421b06919f8d9f09aad702f"
        },
        "revision": 1,
        "state": {
          "type": "awaiting-attempt",
          "activation": {